{
  "$schema": "../../../schema/structure.schema.json",
  "id": "gb-g6-social-studies",
  "curriculum": "gb",
  "grade": "g6",
  "subject": "social-studies",
  "title": {
    "ar": "الدراسات الاجتماعية",
    "en": "UAE Social Studies"
  },
  "lang": "en",
  "status": "authored",
  "concept": "society",
  "source": {
    "publisher": "aldar",
    "title": "UAE MoE Social Studies / Moral Education curriculum",
    "url": "https://www.moe.gov.ae/",
    "license": "LicenseRef-Publisher",
    "standards": "UAE MoE / ADEK Social & Moral Education",
    "examBoard": "National Curriculum for England (DfE)",
    "note": "Aldar Academies' British schools follow the National Curriculum for England (primary/KS3) then IGCSE and A-Level via Pearson Edexcel and Cambridge. Commercial textbooks (Pearson, Cambridge, CGP, Oxford, Collins) are copyrighted and are NOT bundled here; the links below point to the official, free curriculum specifications and free revision resources. To add an actual textbook.pdf, drop a licensed copy into this folder."
  },
  "resources": [
    {
      "title": "National Curriculum in England (DfE, Open Government Licence — free)",
      "url": "https://www.gov.uk/government/collections/national-curriculum"
    },
    {
      "title": "BBC Bitesize — free revision by subject & level",
      "url": "https://www.bbc.co.uk/bitesize"
    },
    {
      "title": "Oak National Academy — free lessons & resources",
      "url": "https://www.thenational.academy/"
    }
  ],
  "contributors": [
    "databayt"
  ],
  "chapters": [
    {
      "slug": "c1",
      "title": {
        "en": "Emirati Heritage & Traditions"
      },
      "lessons": [
        {
          "slug": "l1",
          "title": {
            "en": "Emirati Heritage"
          }
        },
        {
          "slug": "l2",
          "title": {
            "en": "Cultural Identity"
          }
        }
      ]
    },
    {
      "slug": "c2",
      "title": {
        "en": "Respect & Diversity"
      },
      "lessons": [
        {
          "slug": "l1",
          "title": {
            "en": "Living Together"
          }
        },
        {
          "slug": "l2",
          "title": {
            "en": "Self-Discipline"
          }
        }
      ]
    }
  ]
}
