{
  "$schema": "../../../../schema/json/structure.schema.json",
  "id": "sd-g3-islamic-studies",
  "curriculum": "sd",
  "grade": "g3",
  "subject": "islamic-studies",
  "title": {
    "ar": "التربية الإسلامية",
    "en": "Islamic Education"
  },
  "lang": "ar",
  "status": "official",
  "concept": "faith",
  "source": {
    "publisher": "sd-ncerd",
    "basis": "official-toc-2026-08",
    "license": "LicenseRef-Publisher"
  },
  "contributors": [
    "databayt"
  ],
  "chapters": [
    {
      "slug": "01-from-the-holy-quran",
      "title": {
        "ar": "من القرآن الكريم",
        "en": "From the Holy Quran"
      },
      "concept": "faith",
      "image": "clickview/elementary-narrative-writing-cover.jpg",
      "page": 4,
      "lessonsGeneric": false,
      "lessons": [
        {
          "slug": "01-surat-at-takathur",
          "title": {
            "ar": "سورة التكاثر",
            "en": "Surat At-Takathur"
          },
          "page": 6
        },
        {
          "slug": "02-surat-al-qariah",
          "title": {
            "ar": "سورة القارعة",
            "en": "Surat Al-Qari'ah"
          },
          "page": 7
        },
        {
          "slug": "03-surat-az-zalzalah",
          "title": {
            "ar": "سورة الزلزلة",
            "en": "Surat Az-Zalzalah"
          },
          "page": 9
        },
        {
          "slug": "04-surat-ad-duha",
          "title": {
            "ar": "سورة الضحى",
            "en": "Surat Ad-Duha"
          },
          "page": 10
        },
        {
          "slug": "05-surat-al-layl",
          "title": {
            "ar": "سورة الليل",
            "en": "Surat Al-Layl"
          },
          "page": 11
        },
        {
          "slug": "06-surat-al-ala",
          "title": {
            "ar": "سورة الأعلى",
            "en": "Surat Al-A'la"
          },
          "page": 13
        },
        {
          "slug": "07-surat-al-balad",
          "title": {
            "ar": "سورة البلد (تلاوة)",
            "en": "Surat Al-Balad (recitation)"
          },
          "page": 14
        },
        {
          "slug": "08-surat-al-mutaffifin",
          "title": {
            "ar": "سورة المطففين (تلاوة)",
            "en": "Surat Al-Mutaffifin (recitation)"
          },
          "page": 15
        },
        {
          "slug": "09-surat-al-infitar",
          "title": {
            "ar": "سورة الانفطار (تلاوة)",
            "en": "Surat Al-Infitar (recitation)"
          },
          "page": 15
        },
        {
          "slug": "10-surat-at-takwir",
          "title": {
            "ar": "سورة التكوير (تلاوة)",
            "en": "Surat At-Takwir (recitation)"
          },
          "page": 16
        }
      ]
    },
    {
      "slug": "02-prophetic-hadith",
      "title": {
        "ar": "من الحديث النبوي الشريف",
        "en": "From the Noble Prophetic Hadith"
      },
      "concept": "faith",
      "image": "clickview/elementary-purpose-and-audience-in-writing-cover.jpg",
      "page": 16,
      "lessonsGeneric": false,
      "lessons": [
        {
          "slug": "01-hadith-1-no-superiority",
          "title": {
            "ar": "الحديث الأول: لا فضل لعربي على عجمي",
            "en": "Hadith 1: No Arab is superior to a non-Arab"
          },
          "page": 18
        },
        {
          "slug": "02-hadith-2-forbidden-to-the-fire",
          "title": {
            "ar": "الحديث الثاني: ألا أخبركم بمن يحرم على النار",
            "en": "Hadith 2: Shall I tell you who is forbidden to the Fire"
          },
          "page": 20
        },
        {
          "slug": "03-hadith-3-be-a-scholar-or-a-learner",
          "title": {
            "ar": "الحديث الثالث: أغد عالماً أو متعلماً",
            "en": "Hadith 3: Be a scholar or a learner"
          },
          "page": 23,
          "image": "clickview/elementary-the-school-community-cover.jpg"
        },
        {
          "slug": "04-hadith-4-mercy-to-the-young",
          "title": {
            "ar": "الحديث الرابع: ليس منا من لم يرحم صغيرنا",
            "en": "Hadith 4: He is not of us who does not show mercy to our young"
          },
          "page": 26
        }
      ]
    },
    {
      "slug": "03-fiqh",
      "title": {
        "ar": "الفقه",
        "en": "Jurisprudence (Fiqh)"
      },
      "concept": "faith",
      "image": "clickview/elementary-the-water-cycle-cover.jpg",
      "page": 29,
      "lessonsGeneric": false,
      "lessons": [
        {
          "slug": "01-rulings-of-water",
          "title": {
            "ar": "أحكام المياه",
            "en": "Rulings of Water"
          },
          "page": 31
        },
        {
          "slug": "02-etiquette-of-relieving-oneself",
          "title": {
            "ar": "آداب قضاء الحاجة (البول، البراز)",
            "en": "Etiquette of Relieving Oneself"
          },
          "page": 33
        },
        {
          "slug": "03-obligations-and-sunnahs-of-wudu",
          "title": {
            "ar": "فرائض الوضوء وسننه",
            "en": "Obligations and Sunnahs of Wudu"
          },
          "page": 36,
          "image": "clickview/elementary-keeping-clean-and-healthy-cover.jpg"
        }
      ]
    },
    {
      "slug": "04-pillars-of-faith",
      "title": {
        "ar": "أركان الإيمان",
        "en": "Pillars of Faith"
      },
      "concept": "faith",
      "image": "clickview/elementary-the-moon-cover.jpg",
      "page": 37,
      "lessonsGeneric": false,
      "lessons": [
        {
          "slug": "01-belief-in-the-angels",
          "title": {
            "ar": "الإيمان بالملائكة",
            "en": "Belief in the Angels"
          },
          "page": 39
        }
      ]
    },
    {
      "slug": "05-noble-morals",
      "title": {
        "ar": "من مكارم الأخلاق",
        "en": "From the Noble Morals"
      },
      "concept": "faith",
      "image": "clickview/elementary-civic-values-and-virtues-cover.jpg",
      "page": 42,
      "lessonsGeneric": false,
      "lessons": [
        {
          "slug": "01-cooperation-with-others",
          "title": {
            "ar": "التعاون مع الآخرين",
            "en": "Cooperation with Others"
          },
          "page": 44,
          "image": "clickview/elementary-international-friendship-day-cover.jpg"
        },
        {
          "slug": "02-wishing-good-for-people",
          "title": {
            "ar": "حب الخير للناس",
            "en": "Wishing Good for People"
          },
          "page": 46
        },
        {
          "slug": "03-caring-for-the-school",
          "title": {
            "ar": "المحافظة على المدرسة",
            "en": "Caring for the School"
          },
          "page": 47,
          "image": "clickview/elementary-the-school-community-cover.jpg"
        },
        {
          "slug": "04-road-etiquette",
          "title": {
            "ar": "من آداب الطريق",
            "en": "Road Etiquette"
          },
          "page": 49
        },
        {
          "slug": "05-respecting-the-teacher",
          "title": {
            "ar": "احترام المعلم",
            "en": "Respecting the Teacher"
          },
          "page": 51,
          "image": "clickview/elementary-the-school-community-cover.jpg"
        }
      ]
    },
    {
      "slug": "06-prophetic-biography",
      "title": {
        "ar": "من السيرة النبوية الشريفة",
        "en": "From the Noble Prophetic Biography"
      },
      "concept": "faith",
      "image": "clickview/elementary-this-month-in-history-cover.jpg",
      "page": 52,
      "lessonsGeneric": false,
      "lessons": [
        {
          "slug": "01-beginning-of-prophethood",
          "title": {
            "ar": "بداية النبوة والرسالة",
            "en": "The Beginning of Prophethood and the Message"
          },
          "page": 54
        },
        {
          "slug": "02-striving-in-the-call-to-allah",
          "title": {
            "ar": "من جهاد الدعوة إلى الله",
            "en": "From the Striving of the Call to Allah"
          },
          "page": 57
        },
        {
          "slug": "03-public-proclamation-of-the-call",
          "title": {
            "ar": "مرحلة إعلان الدعوة الجهرية",
            "en": "The Stage of the Public Proclamation of the Call"
          },
          "page": 61
        },
        {
          "slug": "04-ways-of-opposing-the-call",
          "title": {
            "ar": "طرق مجابهة الدعوة",
            "en": "Ways of Opposing the Call"
          },
          "page": 64
        },
        {
          "slug": "05-persecution-and-torture",
          "title": {
            "ar": "الاضطهاد والتعذيب",
            "en": "Persecution and Torture"
          },
          "page": 66
        },
        {
          "slug": "06-assault-on-the-messenger",
          "title": {
            "ar": "الاعتداء على الرسول صلى الله عليه وسلم",
            "en": "The Assault on the Messenger ﷺ"
          },
          "page": 69
        }
      ]
    }
  ]
}
