{
  "$schema": "../../../schema/structure.schema.json",
  "id": "caie-igcse-g10-math",
  "curriculum": "caie-igcse",
  "grade": "g10",
  "subject": "math",
  "title": {
    "ar": "الرياضيات",
    "en": "Mathematics (0580)"
  },
  "lang": "en",
  "status": "authored",
  "concept": "math",
  "source": {
    "publisher": "cambridge",
    "url": "https://www.cambridgeinternational.org/programmes-and-qualifications/cambridge-upper-secondary/cambridge-igcse/subjects/",
    "license": "LicenseRef-Publisher"
  },
  "contributors": [
    "databayt"
  ],
  "chapters": [
    {
      "slug": "c1",
      "title": {
        "en": "Number"
      },
      "lessons": [
        {
          "slug": "l1",
          "title": {
            "en": "Number"
          }
        }
      ]
    },
    {
      "slug": "c2",
      "title": {
        "en": "Algebra and Graphs"
      },
      "lessons": [
        {
          "slug": "l1",
          "title": {
            "en": "Algebra and Graphs"
          }
        }
      ]
    },
    {
      "slug": "c3",
      "title": {
        "en": "Coordinate Geometry"
      },
      "lessons": [
        {
          "slug": "l1",
          "title": {
            "en": "Coordinate Geometry"
          }
        }
      ]
    },
    {
      "slug": "c4",
      "title": {
        "en": "Geometry"
      },
      "lessons": [
        {
          "slug": "l1",
          "title": {
            "en": "Geometry"
          }
        }
      ]
    },
    {
      "slug": "c5",
      "title": {
        "en": "Mensuration"
      },
      "lessons": [
        {
          "slug": "l1",
          "title": {
            "en": "Mensuration"
          }
        }
      ]
    },
    {
      "slug": "c6",
      "title": {
        "en": "Trigonometry"
      },
      "lessons": [
        {
          "slug": "l1",
          "title": {
            "en": "Trigonometry"
          }
        }
      ]
    },
    {
      "slug": "c7",
      "title": {
        "en": "Transformations and Vectors"
      },
      "lessons": [
        {
          "slug": "l1",
          "title": {
            "en": "Transformations and Vectors"
          }
        }
      ]
    },
    {
      "slug": "c8",
      "title": {
        "en": "Probability"
      },
      "lessons": [
        {
          "slug": "l1",
          "title": {
            "en": "Probability"
          }
        }
      ]
    },
    {
      "slug": "c9",
      "title": {
        "en": "Statistics"
      },
      "lessons": [
        {
          "slug": "l1",
          "title": {
            "en": "Statistics"
          }
        }
      ]
    }
  ]
}
