{
  "$schema": "../../../../schema/json/structure.schema.json",
  "id": "gb-g6-math",
  "curriculum": "gb",
  "grade": "g6",
  "subject": "math",
  "title": {
    "ar": "الرياضيات",
    "en": "Mathematics"
  },
  "lang": "en",
  "status": "authored",
  "concept": "math",
  "source": {
    "publisher": "aldar",
    "title": "National Curriculum in England: Mathematics programmes of study",
    "url": "https://www.gov.uk/government/publications/national-curriculum-in-england-mathematics-programmes-of-study",
    "license": "LicenseRef-Publisher",
    "standards": "England NC KS2 Year 6",
    "examBoard": "National Curriculum for England (DfE)",
    "note": "Aldar Academies' British schools follow the National Curriculum for England (primary/KS3) then IGCSE and A-Level via Pearson Edexcel and Cambridge. Commercial textbooks (Pearson, Cambridge, CGP, Oxford, Collins) are copyrighted and are NOT bundled here; the links below point to the official, free curriculum specifications and free revision resources. To add an actual textbook.pdf, drop a licensed copy into this folder."
  },
  "resources": [
    {
      "title": "National Curriculum in England (DfE, Open Government Licence — free)",
      "url": "https://www.gov.uk/government/collections/national-curriculum"
    },
    {
      "title": "BBC Bitesize — free revision by subject & level",
      "url": "https://www.bbc.co.uk/bitesize"
    },
    {
      "title": "Oak National Academy — free lessons & resources",
      "url": "https://www.thenational.academy/"
    }
  ],
  "contributors": [
    "databayt"
  ],
  "chapters": [
    {
      "slug": "01-ratio-algebra",
      "title": {
        "en": "Ratio & Algebra"
      },
      "lessons": [
        {
          "slug": "01-ratio",
          "title": {
            "en": "Ratio & Proportion"
          }
        },
        {
          "slug": "02-algebra",
          "title": {
            "en": "Simple Algebra"
          }
        }
      ]
    },
    {
      "slug": "02-geometry",
      "title": {
        "en": "Geometry & Measures"
      },
      "lessons": [
        {
          "slug": "01-area-perimeter",
          "title": {
            "en": "Area & Perimeter"
          }
        },
        {
          "slug": "02-angles",
          "title": {
            "en": "Angles"
          }
        }
      ]
    }
  ]
}
