{
  "$schema": "../../../schema/structure.schema.json",
  "id": "caie-igcse-g10-chemistry",
  "curriculum": "caie-igcse",
  "grade": "g10",
  "subject": "chemistry",
  "title": {
    "ar": "الكيمياء",
    "en": "Chemistry (0620)"
  },
  "lang": "en",
  "status": "authored",
  "concept": "chemistry",
  "source": {
    "publisher": "cambridge",
    "url": "https://www.cambridgeinternational.org/programmes-and-qualifications/cambridge-upper-secondary/cambridge-igcse/subjects/",
    "license": "LicenseRef-Publisher"
  },
  "contributors": [
    "databayt"
  ],
  "chapters": [
    {
      "slug": "c1",
      "title": {
        "en": "States of Matter"
      },
      "lessons": [
        {
          "slug": "l1",
          "title": {
            "en": "States of Matter"
          }
        }
      ]
    },
    {
      "slug": "c2",
      "title": {
        "en": "Atoms, Elements and Compounds"
      },
      "lessons": [
        {
          "slug": "l1",
          "title": {
            "en": "Atoms, Elements and Compounds"
          }
        }
      ]
    },
    {
      "slug": "c3",
      "title": {
        "en": "Stoichiometry"
      },
      "lessons": [
        {
          "slug": "l1",
          "title": {
            "en": "Stoichiometry"
          }
        }
      ]
    },
    {
      "slug": "c4",
      "title": {
        "en": "Electrochemistry"
      },
      "lessons": [
        {
          "slug": "l1",
          "title": {
            "en": "Electrochemistry"
          }
        }
      ]
    },
    {
      "slug": "c5",
      "title": {
        "en": "Chemical Energetics"
      },
      "lessons": [
        {
          "slug": "l1",
          "title": {
            "en": "Chemical Energetics"
          }
        }
      ]
    },
    {
      "slug": "c6",
      "title": {
        "en": "Chemical Reactions"
      },
      "lessons": [
        {
          "slug": "l1",
          "title": {
            "en": "Chemical Reactions"
          }
        }
      ]
    },
    {
      "slug": "c7",
      "title": {
        "en": "Acids, Bases and Salts"
      },
      "lessons": [
        {
          "slug": "l1",
          "title": {
            "en": "Acids, Bases and Salts"
          }
        }
      ]
    },
    {
      "slug": "c8",
      "title": {
        "en": "The Periodic Table"
      },
      "lessons": [
        {
          "slug": "l1",
          "title": {
            "en": "The Periodic Table"
          }
        }
      ]
    },
    {
      "slug": "c9",
      "title": {
        "en": "Metals"
      },
      "lessons": [
        {
          "slug": "l1",
          "title": {
            "en": "Metals"
          }
        }
      ]
    },
    {
      "slug": "c10",
      "title": {
        "en": "Chemistry of the Environment"
      },
      "lessons": [
        {
          "slug": "l1",
          "title": {
            "en": "Chemistry of the Environment"
          }
        }
      ]
    },
    {
      "slug": "c11",
      "title": {
        "en": "Organic Chemistry"
      },
      "lessons": [
        {
          "slug": "l1",
          "title": {
            "en": "Organic Chemistry"
          }
        }
      ]
    },
    {
      "slug": "c12",
      "title": {
        "en": "Experimental Techniques and Chemical Analysis"
      },
      "lessons": [
        {
          "slug": "l1",
          "title": {
            "en": "Experimental Techniques and Chemical Analysis"
          }
        }
      ]
    }
  ]
}
