{
  "$schema": "../../../../schema/json/structure.schema.json",
  "id": "caie-igcse-g10-biology",
  "curriculum": "caie-igcse",
  "grade": "g10",
  "subject": "biology",
  "title": {
    "ar": "الأحياء",
    "en": "Biology (0610)"
  },
  "lang": "en",
  "status": "authored",
  "concept": "life",
  "source": {
    "publisher": "cambridge",
    "url": "https://www.cambridgeinternational.org/programmes-and-qualifications/cambridge-upper-secondary/cambridge-igcse/subjects/",
    "license": "LicenseRef-Publisher"
  },
  "contributors": [
    "databayt"
  ],
  "chapters": [
    {
      "slug": "01-characteristics-and-classification-of-living",
      "title": {
        "en": "Characteristics and Classification of Living Organisms"
      },
      "lessons": [
        {
          "slug": "01-characteristics-and-classification-of-living-organisms",
          "title": {
            "en": "Characteristics and Classification of Living Organisms"
          }
        }
      ]
    },
    {
      "slug": "02-organisation-of-the-organism",
      "title": {
        "en": "Organisation of the Organism"
      },
      "lessons": [
        {
          "slug": "01-organisation-of-the-organism",
          "title": {
            "en": "Organisation of the Organism"
          }
        }
      ]
    },
    {
      "slug": "03-movement-into-and-out-of-cells",
      "title": {
        "en": "Movement into and out of Cells"
      },
      "lessons": [
        {
          "slug": "01-movement-into-and-out-of-cells",
          "title": {
            "en": "Movement into and out of Cells"
          }
        }
      ]
    },
    {
      "slug": "04-biological-molecules",
      "title": {
        "en": "Biological Molecules"
      },
      "lessons": [
        {
          "slug": "01-biological-molecules",
          "title": {
            "en": "Biological Molecules"
          }
        }
      ]
    },
    {
      "slug": "05-enzymes",
      "title": {
        "en": "Enzymes"
      },
      "lessons": [
        {
          "slug": "01-enzymes",
          "title": {
            "en": "Enzymes"
          }
        }
      ]
    },
    {
      "slug": "06-plant-nutrition",
      "title": {
        "en": "Plant Nutrition"
      },
      "lessons": [
        {
          "slug": "01-plant-nutrition",
          "title": {
            "en": "Plant Nutrition"
          }
        }
      ]
    },
    {
      "slug": "07-human-nutrition",
      "title": {
        "en": "Human Nutrition"
      },
      "lessons": [
        {
          "slug": "01-human-nutrition",
          "title": {
            "en": "Human Nutrition"
          }
        }
      ]
    },
    {
      "slug": "08-transport-in-plants",
      "title": {
        "en": "Transport in Plants"
      },
      "lessons": [
        {
          "slug": "01-transport-in-plants",
          "title": {
            "en": "Transport in Plants"
          }
        }
      ]
    },
    {
      "slug": "09-transport-in-animals",
      "title": {
        "en": "Transport in Animals"
      },
      "lessons": [
        {
          "slug": "01-transport-in-animals",
          "title": {
            "en": "Transport in Animals"
          }
        }
      ]
    },
    {
      "slug": "10-diseases-and-immunity",
      "title": {
        "en": "Diseases and Immunity"
      },
      "lessons": [
        {
          "slug": "01-diseases-and-immunity",
          "title": {
            "en": "Diseases and Immunity"
          }
        }
      ]
    },
    {
      "slug": "11-gas-exchange-in-humans",
      "title": {
        "en": "Gas Exchange in Humans"
      },
      "lessons": [
        {
          "slug": "01-gas-exchange-in-humans",
          "title": {
            "en": "Gas Exchange in Humans"
          }
        }
      ]
    },
    {
      "slug": "12-respiration",
      "title": {
        "en": "Respiration"
      },
      "lessons": [
        {
          "slug": "01-respiration",
          "title": {
            "en": "Respiration"
          }
        }
      ]
    },
    {
      "slug": "13-excretion-in-humans",
      "title": {
        "en": "Excretion in Humans"
      },
      "lessons": [
        {
          "slug": "01-excretion-in-humans",
          "title": {
            "en": "Excretion in Humans"
          }
        }
      ]
    },
    {
      "slug": "14-coordination-and-response",
      "title": {
        "en": "Coordination and Response"
      },
      "lessons": [
        {
          "slug": "01-coordination-and-response",
          "title": {
            "en": "Coordination and Response"
          }
        }
      ]
    },
    {
      "slug": "15-drugs",
      "title": {
        "en": "Drugs"
      },
      "lessons": [
        {
          "slug": "01-drugs",
          "title": {
            "en": "Drugs"
          }
        }
      ]
    },
    {
      "slug": "16-reproduction",
      "title": {
        "en": "Reproduction"
      },
      "lessons": [
        {
          "slug": "01-reproduction",
          "title": {
            "en": "Reproduction"
          }
        }
      ]
    },
    {
      "slug": "17-inheritance",
      "title": {
        "en": "Inheritance"
      },
      "lessons": [
        {
          "slug": "01-inheritance",
          "title": {
            "en": "Inheritance"
          }
        }
      ]
    },
    {
      "slug": "18-variation-and-selection",
      "title": {
        "en": "Variation and Selection"
      },
      "lessons": [
        {
          "slug": "01-variation-and-selection",
          "title": {
            "en": "Variation and Selection"
          }
        }
      ]
    },
    {
      "slug": "19-organisms-and-their-environment",
      "title": {
        "en": "Organisms and their Environment"
      },
      "lessons": [
        {
          "slug": "01-organisms-and-their-environment",
          "title": {
            "en": "Organisms and their Environment"
          }
        }
      ]
    },
    {
      "slug": "20-human-influences-on-ecosystems",
      "title": {
        "en": "Human Influences on Ecosystems"
      },
      "lessons": [
        {
          "slug": "01-human-influences-on-ecosystems",
          "title": {
            "en": "Human Influences on Ecosystems"
          }
        }
      ]
    },
    {
      "slug": "21-biotechnology-and-genetic-modification",
      "title": {
        "en": "Biotechnology and Genetic Modification"
      },
      "lessons": [
        {
          "slug": "01-biotechnology-and-genetic-modification",
          "title": {
            "en": "Biotechnology and Genetic Modification"
          }
        }
      ]
    }
  ]
}
