{
  "$schema": "../../../../schema/json/structure.schema.json",
  "id": "gb-g12-arabic",
  "curriculum": "gb",
  "grade": "g12",
  "subject": "arabic",
  "title": {
    "ar": "اللغة العربية",
    "en": "Arabic Language"
  },
  "lang": "ar",
  "status": "authored",
  "concept": "language",
  "source": {
    "publisher": "aldar",
    "title": "UAE MoE Arabic Language curriculum",
    "url": "https://www.moe.gov.ae/",
    "license": "LicenseRef-Publisher",
    "standards": "UAE MoE / ADEK Arabic",
    "examBoard": "Pearson Edexcel / Cambridge International AS & A-Level (as used by Aldar Academies)",
    "note": "Aldar Academies' British schools follow the National Curriculum for England (primary/KS3) then IGCSE and A-Level via Pearson Edexcel and Cambridge. Commercial textbooks (Pearson, Cambridge, CGP, Oxford, Collins) are copyrighted and are NOT bundled here; the links below point to the official, free curriculum specifications and free revision resources. To add an actual textbook.pdf, drop a licensed copy into this folder."
  },
  "resources": [
    {
      "title": "National Curriculum in England (DfE, Open Government Licence — free)",
      "url": "https://www.gov.uk/government/collections/national-curriculum"
    },
    {
      "title": "BBC Bitesize — free revision by subject & level",
      "url": "https://www.bbc.co.uk/bitesize"
    },
    {
      "title": "Oak National Academy — free lessons & resources",
      "url": "https://www.thenational.academy/"
    },
    {
      "title": "Pearson Edexcel A-Level specifications (free PDFs)",
      "url": "https://qualifications.pearson.com/en/qualifications/edexcel-a-levels.html"
    },
    {
      "title": "Cambridge International AS & A-Level syllabuses (free PDFs)",
      "url": "https://www.cambridgeinternational.org/programmes-and-qualifications/cambridge-advanced/"
    }
  ],
  "contributors": [
    "databayt"
  ],
  "chapters": [
    {
      "slug": "01-criticism",
      "title": {
        "ar": "النقد والتعبير"
      },
      "lessons": [
        {
          "slug": "01-criticism",
          "title": {
            "ar": "النقد الأدبي"
          }
        },
        {
          "slug": "02-composition",
          "title": {
            "ar": "التعبير الكتابي"
          }
        }
      ]
    },
    {
      "slug": "02-schools",
      "title": {
        "ar": "المدارس الأدبية"
      },
      "lessons": [
        {
          "slug": "01-classical",
          "title": {
            "ar": "المدرسة الكلاسيكية (الإحياء)"
          }
        },
        {
          "slug": "02-modern",
          "title": {
            "ar": "المدارس الحديثة"
          }
        }
      ]
    }
  ]
}
