{
  "$schema": "../../../schema/structure.schema.json",
  "id": "us-g8-science",
  "curriculum": "us",
  "grade": "g8",
  "subject": "science",
  "title": {
    "ar": "العلوم",
    "en": "Science"
  },
  "lang": "en",
  "status": "authored",
  "concept": "science",
  "source": {
    "publisher": "aldar",
    "title": "Next Generation Science Standards (NGSS)",
    "url": "https://www.nextgenscience.org/",
    "license": "LicenseRef-Publisher",
    "standards": "NGSS g8",
    "standardsBody": "Massachusetts Curriculum Frameworks; Common Core (ELA & Math); NGSS (Science)",
    "note": "Aldar's American schools follow the Massachusetts State Standards (Common Core for ELA & Math, NGSS for Science), with Advanced Placement at high school and the American High School Diploma. Commercial textbooks (McGraw-Hill, Savvas/Pearson, HMH) are copyrighted and are NOT bundled here. The links below point to the official free standards and to genuinely free / openly-licensed resources (OpenStax and CK-12 are CC-licensed and may be added as a textbook.pdf). To add a book, drop a licensed or open-licensed copy into this folder."
  },
  "resources": [
    {
      "title": "Common Core State Standards (free)",
      "url": "https://www.thecorestandards.org/"
    },
    {
      "title": "Next Generation Science Standards (free)",
      "url": "https://www.nextgenscience.org/"
    },
    {
      "title": "Massachusetts Curriculum Frameworks (free)",
      "url": "https://www.doe.mass.edu/frameworks/"
    },
    {
      "title": "Khan Academy — free lessons & practice",
      "url": "https://www.khanacademy.org/"
    },
    {
      "title": "CK-12 — free, openly-licensed textbooks (FlexBooks)",
      "url": "https://www.ck12.org/"
    }
  ],
  "contributors": [
    "databayt"
  ],
  "chapters": [
    {
      "slug": "01-forces-motion",
      "title": {
        "en": "Forces & Motion"
      },
      "lessons": [
        {
          "slug": "01-newtons-laws",
          "title": {
            "en": "Newton's Laws of Motion"
          }
        },
        {
          "slug": "02-gravity",
          "title": {
            "en": "Gravity & Motion"
          }
        }
      ]
    },
    {
      "slug": "02-earth-space",
      "title": {
        "en": "Earth & Space Systems"
      },
      "lessons": [
        {
          "slug": "01-plate-tectonics",
          "title": {
            "en": "Plate Tectonics"
          }
        },
        {
          "slug": "02-solar-system",
          "title": {
            "en": "The Solar System & Universe"
          }
        }
      ]
    }
  ]
}
