{
  "$schema": "../../../schema/structure.schema.json",
  "id": "gb-g3-french",
  "curriculum": "gb",
  "grade": "g3",
  "subject": "french",
  "title": {
    "ar": "اللغة الفرنسية",
    "en": "French (MFL)"
  },
  "lang": "fr",
  "status": "authored",
  "concept": "language",
  "source": {
    "publisher": "aldar",
    "title": "French (MFL) (curriculum-aligned)",
    "url": "https://www.aldar.com/education/curriculum/british-curriculum",
    "license": "LicenseRef-Publisher",
    "standards": "National Curriculum for England, tailored for the UAE (ADEK), I/GCSE & A-Level",
    "examBoard": "National Curriculum for England (DfE)",
    "note": "Aldar Academies' British schools follow the National Curriculum for England (primary/KS3) then IGCSE and A-Level via Pearson Edexcel and Cambridge. Commercial textbooks (Pearson, Cambridge, CGP, Oxford, Collins) are copyrighted and are NOT bundled here; the links below point to the official, free curriculum specifications and free revision resources. To add an actual textbook.pdf, drop a licensed copy into this folder."
  },
  "resources": [
    {
      "title": "National Curriculum in England (DfE, Open Government Licence — free)",
      "url": "https://www.gov.uk/government/collections/national-curriculum"
    },
    {
      "title": "BBC Bitesize — free revision by subject & level",
      "url": "https://www.bbc.co.uk/bitesize"
    },
    {
      "title": "Oak National Academy — free lessons & resources",
      "url": "https://www.thenational.academy/"
    }
  ],
  "contributors": [
    "databayt"
  ],
  "chapters": [
    {
      "slug": "c1",
      "title": {
        "fr": "Greetings & Self"
      },
      "lessons": [
        {
          "slug": "l1",
          "title": {
            "fr": "Greetings & Introductions"
          }
        },
        {
          "slug": "l2",
          "title": {
            "fr": "Numbers & Age"
          }
        }
      ]
    },
    {
      "slug": "c2",
      "title": {
        "fr": "Daily Life & Grammar"
      },
      "lessons": [
        {
          "slug": "l1",
          "title": {
            "fr": "School & Food"
          }
        },
        {
          "slug": "l2",
          "title": {
            "fr": "Articles & Gender"
          }
        }
      ]
    }
  ]
}
